{
  "uaicp_version": "0.2",
  "request_id": "f47ac10b-58cc-4372-a567-0e02b2c3d479",
  "trace_id": "trace-1001",
  "state": "execute",
  "timestamp": "2026-01-01T00:00:00.000Z",
  "identity": {
    "agent_id": "agent:finance/approval-bot",
    "owner_id": "org:uaicp-demo",
    "user_id": "user-456",
    "control_class": "human-directed"
  },
  "outcome": "pending",
  "metadata": {
    "intent": "reverse_wire_transfer"
  }
}